{
  "alignment_id": "cantor_pica_alignment_v1",
  "family_alignment": [
    {
      "active_cells_current": [
        "P4<-P4",
        "P5<-P4"
      ],
      "active_cells_target": [
        "P2<-P4",
        "P4<-P4",
        "P5<-P4"
      ],
      "family_id": "classical.middle_thirds",
      "lens_modes_current": [
        "cylinder-depth"
      ],
      "lens_modes_target": [
        "cylinder-depth",
        "pressure-depth"
      ],
      "notes": "Baseline classical self-similar family.",
      "packaging_modes_current": [
        "interval-union-coalesced"
      ],
      "packaging_modes_target": [
        "interval-union-coalesced",
        "branch-package-audit"
      ],
      "pica_status": "representative",
      "primitive_tags": [
        "P2",
        "P4",
        "P5"
      ],
      "role": "baseline"
    },
    {
      "active_cells_current": [
        "P4<-P4",
        "P5<-P4"
      ],
      "active_cells_target": [
        "P2<-P4",
        "P4<-P4",
        "P5<-P4"
      ],
      "family_id": "classical.restricted_digits_base4_02",
      "lens_modes_current": [
        "cylinder-depth"
      ],
      "lens_modes_target": [
        "cylinder-depth",
        "pressure-depth"
      ],
      "notes": "Classical restricted-digit baseline.",
      "packaging_modes_current": [
        "interval-union-coalesced"
      ],
      "packaging_modes_target": [
        "interval-union-coalesced"
      ],
      "pica_status": "representative",
      "primitive_tags": [
        "P2",
        "P4",
        "P5"
      ],
      "role": "baseline"
    },
    {
      "active_cells_current": [
        "P4<-P4",
        "P5<-P4"
      ],
      "active_cells_target": [
        "P2<-P4",
        "P4<-P4",
        "P5<-P4"
      ],
      "family_id": "classical.restricted_digits_base5_024",
      "lens_modes_current": [
        "cylinder-depth"
      ],
      "lens_modes_target": [
        "cylinder-depth",
        "pressure-depth"
      ],
      "notes": "Classical restricted-digit baseline.",
      "packaging_modes_current": [
        "interval-union-coalesced"
      ],
      "packaging_modes_target": [
        "interval-union-coalesced"
      ],
      "pica_status": "representative",
      "primitive_tags": [
        "P2",
        "P4",
        "P5"
      ],
      "role": "baseline"
    },
    {
      "active_cells_current": [
        "P4<-P4",
        "P5<-P4",
        "P6<-P6"
      ],
      "active_cells_target": [
        "P2<-P4",
        "P4<-P4",
        "P5<-P4",
        "P5<-P6",
        "P6<-P6"
      ],
      "family_id": "contextual_local.domain_gated_two_map_local_ifs",
      "lens_modes_current": [
        "fixed-domain-lens"
      ],
      "lens_modes_target": [
        "fixed-domain-lens",
        "pressure-depth"
      ],
      "notes": "Primary behavior is P2/P5/P6 with fixed lens and packaging choices in current code.",
      "packaging_modes_current": [
        "interval-union-coalesced"
      ],
      "packaging_modes_target": [
        "interval-union-coalesced",
        "audit-tagged-packaging"
      ],
      "pica_status": "partial",
      "primitive_tags": [
        "P2",
        "P5",
        "P6"
      ],
      "role": "probe"
    },
    {
      "active_cells_current": [
        "P2<-P6",
        "P5<-P6",
        "P6<-P6"
      ],
      "active_cells_target": [
        "P2<-P4",
        "P2<-P6",
        "P5<-P4",
        "P5<-P6",
        "P6<-P6"
      ],
      "family_id": "contextual_local.feedback_budget_gate_and_packaging",
      "lens_modes_current": [
        "raw_cylinders"
      ],
      "lens_modes_target": [
        "raw_cylinders",
        "coalesced_intervals"
      ],
      "notes": "Current family has internal feedback: budget/audit observations drive gating protocol adaptation and packaging adaptation.",
      "packaging_modes_current": [
        "merge_touching",
        "budget_capped_merge"
      ],
      "packaging_modes_target": [
        "merge_touching",
        "budget_capped_merge"
      ],
      "pica_status": "representative",
      "primitive_tags": [
        "P2",
        "P5",
        "P6"
      ],
      "role": "probe"
    },
    {
      "active_cells_current": [
        "P2<-P4",
        "P3<-P4",
        "P4<-P3",
        "P4<-P4",
        "P5<-P4"
      ],
      "active_cells_target": [
        "P2<-P4",
        "P3<-P4",
        "P4<-P3",
        "P4<-P4",
        "P5<-P4"
      ],
      "family_id": "contextual_local.feedback_lens_protocol_coupled",
      "lens_modes_current": [
        "prefix_sectors",
        "coalesced_intervals"
      ],
      "lens_modes_target": [
        "raw_cylinders",
        "prefix_sectors",
        "coalesced_intervals"
      ],
      "notes": "Current family has internal feedback: lens observation updates protocol and gating (P3<-P4, P2<-P4), protocol adaptation updates lens mode (P4<-P3), and lens signals can switch packaging mode (P5<-P4).",
      "packaging_modes_current": [
        "merge_touching"
      ],
      "packaging_modes_target": [
        "merge_touching",
        "budget_capped_merge"
      ],
      "pica_status": "representative",
      "primitive_tags": [
        "P2",
        "P3",
        "P4"
      ],
      "role": "probe"
    },
    {
      "active_cells_current": [
        "P4<-P4"
      ],
      "active_cells_target": [
        "P2<-P4",
        "P4<-P4"
      ],
      "family_id": "contextual_local.prefix_memory_last_digit_rule",
      "lens_modes_current": [
        "memory-annotated-symbolic-depth"
      ],
      "lens_modes_target": [
        "memory-annotated-symbolic-depth"
      ],
      "notes": "Primarily P2-with-memory gating; not a full P3 realization.",
      "packaging_modes_current": [
        "branch-sum"
      ],
      "packaging_modes_target": [
        "branch-sum",
        "coalesced-interval-projection"
      ],
      "pica_status": "partial",
      "primitive_tags": [
        "P2"
      ],
      "role": "probe"
    },
    {
      "active_cells_current": [
        "P4<-P4"
      ],
      "active_cells_target": [
        "P2<-P4",
        "P4<-P4"
      ],
      "family_id": "contextual_local.prefix_memory_no_22_base3",
      "lens_modes_current": [
        "memory-annotated-symbolic-depth"
      ],
      "lens_modes_target": [
        "memory-annotated-symbolic-depth",
        "pressure-depth"
      ],
      "notes": "Primarily P2-with-memory constraint; no internal protocol adaptation.",
      "packaging_modes_current": [
        "branch-sum"
      ],
      "packaging_modes_target": [
        "branch-sum",
        "coalesced-interval-projection"
      ],
      "pica_status": "partial",
      "primitive_tags": [
        "P2"
      ],
      "role": "probe"
    },
    {
      "active_cells_current": [
        "P4<-P4"
      ],
      "active_cells_target": [
        "P2<-P4",
        "P4<-P4",
        "P3<-P4",
        "P4<-P3"
      ],
      "family_id": "contextual_local.stage_dependent_alternating_removal",
      "lens_modes_current": [
        "stage-scheduled-symbolic-depth"
      ],
      "lens_modes_target": [
        "stage-scheduled-symbolic-depth",
        "protocol-adaptive-depth"
      ],
      "notes": "Nonautonomous schedule control only; not a genuine P3 family with internal feedback/protocol adaptation.",
      "packaging_modes_current": [
        "interval-union-coalesced"
      ],
      "packaging_modes_target": [
        "interval-union-coalesced",
        "audit-tagged-packaging"
      ],
      "pica_status": "control_only",
      "primitive_tags": [
        "P2",
        "P4"
      ],
      "role": "control"
    },
    {
      "active_cells_current": [
        "P4<-P4"
      ],
      "active_cells_target": [
        "P2<-P4",
        "P4<-P4"
      ],
      "family_id": "control.middle_thirds_symbolic",
      "lens_modes_current": [
        "symbolic-control"
      ],
      "lens_modes_target": [
        "symbolic-control"
      ],
      "notes": "Control mirror of classical middle-thirds.",
      "packaging_modes_current": [
        "branch-sum"
      ],
      "packaging_modes_target": [
        "branch-sum"
      ],
      "pica_status": "control_only",
      "primitive_tags": [
        "P2",
        "P4"
      ],
      "role": "control"
    },
    {
      "active_cells_current": [
        "P4<-P4"
      ],
      "active_cells_target": [
        "P2<-P4",
        "P4<-P4"
      ],
      "family_id": "control.restricted_digits_base5_024_symbolic",
      "lens_modes_current": [
        "symbolic-control"
      ],
      "lens_modes_target": [
        "symbolic-control"
      ],
      "notes": "Control mirror of restricted base-5 family.",
      "packaging_modes_current": [
        "branch-sum"
      ],
      "packaging_modes_target": [
        "branch-sum"
      ],
      "pica_status": "control_only",
      "primitive_tags": [
        "P2",
        "P4"
      ],
      "role": "control"
    },
    {
      "active_cells_current": [
        "P4<-P4"
      ],
      "active_cells_target": [
        "P2<-P4",
        "P4<-P4"
      ],
      "family_id": "finite_state.adjacency_no_consecutive_2_base3",
      "lens_modes_current": [
        "symbolic-graph-depth"
      ],
      "lens_modes_target": [
        "symbolic-graph-depth",
        "pressure-depth"
      ],
      "notes": "Finite-state SFT baseline with symbolic admissibility.",
      "packaging_modes_current": [
        "branch-sum"
      ],
      "packaging_modes_target": [
        "branch-sum",
        "audit-tagged-branch-sum"
      ],
      "pica_status": "partial",
      "primitive_tags": [
        "P2",
        "P4"
      ],
      "role": "baseline"
    },
    {
      "active_cells_current": [
        "P4<-P4"
      ],
      "active_cells_target": [
        "P2<-P4",
        "P4<-P4"
      ],
      "family_id": "finite_state.graph_directed_two_vertex_similarity",
      "lens_modes_current": [
        "graph-directed-depth"
      ],
      "lens_modes_target": [
        "graph-directed-depth",